{
  "$schema": "../business.schema.json",
  "slug": "probeauty",
  "name": "probeauty",
  "short_name": "probeauty",
  "kind": "beauty",
  "timezone": "Asia/Almaty",
  "currency": "KZT",
  "locale": "ru-RU",
  "accent_color": "#D9BC8C",
  "tagline": "Салон красоты в Астане",
  "description": "Стрижки и окрашивание, маникюр и педикюр, брови и ресницы, макияж, шугаринг. Выберите услугу и удобное время онлайн, без звонков и ожидания ответа.",
  "contacts": {
    "address": "Астана, улица Шолпан Иманбаевой, 8",
    "address_note": "",
    "phone": "+77787878784",
    "map_url": "https://2gis.kz/astana/firm/70000001081124905"
  },
  "booking": {
    "cancellation_hours": 3,
    "slot_step_minutes": 30,
    "min_notice_minutes": 60,
    "horizon_days": 30,
    "reminder_hours": 3
  },
  "images": {
    "logo": "logo.png",
    "hero": "hero.jpg"
  },
  "info_cards": [
    {
      "icon": "star",
      "title": "Рейтинг 4,9 в 2GIS",
      "text": "451 отзыв клиентов."
    },
    {
      "icon": "scissors",
      "title": "Запись за минуту",
      "text": "Выберите услугу и время, без звонков и переписки в директе."
    },
    {
      "icon": "thumbs-up",
      "title": "Удобная оплата",
      "text": "Картой, по QR-коду или наличными."
    }
  ],
  "resources": [
    {
      "key": "hair-1",
      "name": "Парикмахер 1"
    },
    {
      "key": "hair-2",
      "name": "Парикмахер 2"
    },
    {
      "key": "nails-1",
      "name": "Мастер маникюра 1"
    },
    {
      "key": "nails-2",
      "name": "Мастер маникюра 2"
    },
    {
      "key": "brows-1",
      "name": "Мастер бровей и ресниц"
    },
    {
      "key": "makeup-1",
      "name": "Визажист"
    },
    {
      "key": "waxing-1",
      "name": "Мастер депиляции"
    }
  ],
  "services": [
    {
      "key": "haircut-women",
      "name": "Женская стрижка",
      "category": "Волосы",
      "description": "Стрижка с мытьём головы и укладкой феном.",
      "price": 6000,
      "price_is_from": true,
      "duration_minutes": 60,
      "buffer_minutes": 0,
      "resources": [
        "hair-1",
        "hair-2"
      ]
    },
    {
      "key": "haircut-men",
      "name": "Мужская стрижка",
      "category": "Волосы",
      "description": "Машинка и ножницы, мытьё и укладка.",
      "price": 4000,
      "price_is_from": false,
      "duration_minutes": 45,
      "buffer_minutes": 0,
      "resources": [
        "hair-1",
        "hair-2"
      ]
    },
    {
      "key": "coloring",
      "name": "Окрашивание",
      "category": "Волосы",
      "description": "Тон в тон, корни или полное окрашивание. Цена зависит от длины.",
      "price": 20000,
      "price_is_from": true,
      "duration_minutes": 180,
      "buffer_minutes": 15,
      "resources": [
        "hair-1",
        "hair-2"
      ]
    },
    {
      "key": "styling",
      "name": "Укладка",
      "category": "Волосы",
      "description": "Укладка феном, локоны или прямые волосы.",
      "price": 6000,
      "price_is_from": true,
      "duration_minutes": 45,
      "buffer_minutes": 0,
      "resources": [
        "hair-1",
        "hair-2"
      ]
    },
    {
      "key": "manicure-gel",
      "name": "Маникюр с покрытием гель-лак",
      "category": "Ногти",
      "description": "Аппаратный или комбинированный маникюр, выравнивание и покрытие.",
      "price": 7000,
      "price_is_from": false,
      "duration_minutes": 90,
      "buffer_minutes": 0,
      "resources": [
        "nails-1",
        "nails-2"
      ]
    },
    {
      "key": "manicure",
      "name": "Маникюр без покрытия",
      "category": "Ногти",
      "description": "Обработка кутикулы и форма ногтей.",
      "price": 4000,
      "price_is_from": false,
      "duration_minutes": 45,
      "buffer_minutes": 0,
      "resources": [
        "nails-1",
        "nails-2"
      ]
    },
    {
      "key": "pedicure-gel",
      "name": "Педикюр с покрытием",
      "category": "Ногти",
      "description": "Аппаратный педикюр и покрытие гель-лаком.",
      "price": 9000,
      "price_is_from": false,
      "duration_minutes": 90,
      "buffer_minutes": 0,
      "resources": [
        "nails-1",
        "nails-2"
      ]
    },
    {
      "key": "nail-extension",
      "name": "Наращивание ногтей",
      "category": "Ногти",
      "description": "Гель или полигель, форма и длина на выбор, покрытие.",
      "price": 12000,
      "price_is_from": true,
      "duration_minutes": 150,
      "buffer_minutes": 0,
      "resources": [
        "nails-1",
        "nails-2"
      ]
    },
    {
      "key": "brows",
      "name": "Коррекция и окрашивание бровей",
      "category": "Брови и ресницы",
      "description": "Форма, коррекция воском или пинцетом, окрашивание краской или хной.",
      "price": 4000,
      "price_is_from": false,
      "duration_minutes": 45,
      "buffer_minutes": 0,
      "resources": [
        "brows-1"
      ]
    },
    {
      "key": "lash-lamination",
      "name": "Ламинирование ресниц",
      "category": "Брови и ресницы",
      "description": "Изгиб и питание ресниц, эффект держится до 6 недель.",
      "price": 8000,
      "price_is_from": false,
      "duration_minutes": 60,
      "buffer_minutes": 0,
      "resources": [
        "brows-1"
      ]
    },
    {
      "key": "lash-extension",
      "name": "Наращивание ресниц",
      "category": "Брови и ресницы",
      "description": "Классика, 2D или 3D объём.",
      "price": 10000,
      "price_is_from": true,
      "duration_minutes": 120,
      "buffer_minutes": 0,
      "resources": [
        "brows-1"
      ]
    },
    {
      "key": "makeup",
      "name": "Вечерний макияж",
      "category": "Макияж",
      "description": "Макияж на праздник или фотосессию.",
      "price": 12000,
      "price_is_from": true,
      "duration_minutes": 60,
      "buffer_minutes": 0,
      "resources": [
        "makeup-1"
      ]
    },
    {
      "key": "sugaring",
      "name": "Шугаринг",
      "category": "Депиляция",
      "description": "Сахарная депиляция, цена зависит от зоны.",
      "price": 5000,
      "price_is_from": true,
      "duration_minutes": 45,
      "buffer_minutes": 0,
      "resources": [
        "waxing-1"
      ]
    }
  ],
  "hours": {
    "mon": [
      [
        "07:00",
        "21:00"
      ]
    ],
    "tue": [
      [
        "07:00",
        "21:00"
      ]
    ],
    "wed": [
      [
        "07:00",
        "21:00"
      ]
    ],
    "thu": [
      [
        "07:00",
        "21:00"
      ]
    ],
    "fri": [
      [
        "07:00",
        "21:00"
      ]
    ],
    "sat": [
      [
        "07:00",
        "21:00"
      ]
    ],
    "sun": [
      [
        "07:00",
        "21:00"
      ]
    ]
  },
  "closed_dates": [],
  "gallery": [
    {
      "key": "w1",
      "image": "gallery/1-nails.jpg",
      "caption": "Маникюр"
    },
    {
      "key": "w2",
      "image": "gallery/2-color.jpg",
      "caption": "Окрашивание"
    },
    {
      "key": "w3",
      "image": "gallery/3-brows.jpg",
      "caption": "Брови и ресницы"
    },
    {
      "key": "w4",
      "image": "gallery/4-styling.jpg",
      "caption": "Укладка"
    }
  ]
}
