{
  "$schema": "../business.schema.json",
  "slug": "graphite",
  "name": "GRAPHITE Detailing",
  "short_name": "GRAPHITE",
  "kind": "detailing",
  "timezone": "Europe/Moscow",
  "currency": "RUB",
  "locale": "ru-RU",
  "accent_color": "#4690FF",
  "tagline": "Детейлинг-студия полного цикла",
  "description": "Полируем, защищаем и восстанавливаем автомобили бизнес-класса. Работаем в чистых тёплых боксах, показываем каждый этап и отдаём машину в срок.",
  "contacts": {
    "address": "Москва, Шелепихинская наб., 34, стр. 2",
    "address_note": "Въезд с набережной, ворота 3, звоните на КПП",
    "phone": "+74951234567",
    "map_url": "https://yandex.ru/maps/?text=%D0%9C%D0%BE%D1%81%D0%BA%D0%B2%D0%B0%2C%20%D0%A8%D0%B5%D0%BB%D0%B5%D0%BF%D0%B8%D1%85%D0%B8%D0%BD%D1%81%D0%BA%D0%B0%D1%8F%20%D0%BD%D0%B0%D0%B1.%2C%2034"
  },
  "booking": {
    "cancellation_hours": 12,
    "slot_step_minutes": 30,
    "min_notice_minutes": 120,
    "horizon_days": 30,
    "reminder_hours": 24
  },
  "images": {
    "logo": "logo.png",
    "hero": "hero.jpg"
  },
  "info_cards": [
    { "icon": "shield-check", "title": "Гарантия на покрытия", "text": "До 3 лет на керамику и плёнку, гарантийный талон в день выдачи." },
    { "icon": "camera", "title": "Фотоотчёт", "text": "Присылаем фото до и после каждого этапа работ." },
    { "icon": "coffee", "title": "Зона ожидания", "text": "Кофе, Wi‑Fi и окно в бокс, если хотите посмотреть." }
  ],
  "resources": [
    { "key": "bay-1", "name": "Бокс 1" },
    { "key": "bay-2", "name": "Бокс 2" },
    { "key": "wash", "name": "Мойка" }
  ],
  "services": [
    { "key": "detail-wash", "name": "Детейлинг-мойка", "category": "Мойка", "price": 3500, "duration_minutes": 120, "buffer_minutes": 30, "resources": ["wash", "bay-1", "bay-2"], "description": "Трёхфазная мойка, чистка дисков и арок, сушка." },
    { "key": "interior", "name": "Химчистка салона", "category": "Салон", "price": 12000, "price_is_from": true, "duration_minutes": 360, "buffer_minutes": 30, "resources": ["bay-1", "bay-2"], "description": "Сиденья, потолок, ковры, пластик и кондиционер кожи." },
    { "key": "polish", "name": "Полировка кузова", "category": "Кузов", "price": 25000, "price_is_from": true, "duration_minutes": 480, "buffer_minutes": 60, "resources": ["bay-1", "bay-2"], "description": "Восстановительная полировка в два шага, удаление голограмм." },
    { "key": "ceramic", "name": "Керамика 2 слоя", "category": "Защита", "price": 45000, "duration_minutes": 2880, "buffer_minutes": 60, "resources": ["bay-1"], "description": "Подготовка, полировка и два слоя керамики. Машина остаётся у нас двое суток." },
    { "key": "ppf-front", "name": "Плёнка на переднюю часть", "category": "Защита", "price": 90000, "price_is_from": true, "duration_minutes": 2880, "buffer_minutes": 60, "resources": ["bay-2"], "description": "Капот, бампер, фары и зеркала полиуретановой плёнкой." }
  ],
  "hours": {
    "mon": [["10:00", "21:00"]],
    "tue": [["10:00", "21:00"]],
    "wed": [["10:00", "21:00"]],
    "thu": [["10:00", "21:00"]],
    "fri": [["10:00", "21:00"]],
    "sat": [["11:00", "19:00"]],
    "sun": []
  },
  "closed_dates": [
    { "date": "2026-12-31", "note": "Предновогодний день" },
    { "date": "2027-01-01", "note": "Новый год" }
  ],
  "gallery": [
    { "key": "w1", "image": "gallery/porsche.jpg", "caption": "Porsche 911 — полировка и керамика" },
    { "key": "w2", "image": "gallery/bmw.jpg", "caption": "BMW M5 — плёнка на переднюю часть" },
    { "key": "w3", "image": "gallery/interior.jpg", "caption": "Range Rover — химчистка салона" },
    { "key": "w4", "image": "gallery/wheels.jpg", "caption": "Mercedes G — керамика на диски" }
  ],
  "owner": { "email": "owner@graphite.demo" }
}
